{
  "schema_version": 1,
  "warehouse_id": "WH01",
  "revision": 42,
  "generated_at": "2026-10-12T02:00:00.000Z",
  "connections": {"broker":"connected","database":"connected"},
  "zones": [
    {"id":"A","name":"Kho thường","range":[18,30],"capacity":100,"occupied":84,"reserved":0,"environment":{"temperature_c":24.6,"humidity_pct":62},"occupancy":{"current_occupants":4,"count_verified":true,"presence":true}},
    {"id":"B","name":"Kho mát","range":[2,8],"capacity":80,"occupied":64,"reserved":0,"environment":{"temperature_c":9.2,"humidity_pct":58},"occupancy":{"current_occupants":0,"count_verified":true,"presence":false}},
    {"id":"C","name":"Kho lạnh","range":[-22,-16],"capacity":80,"occupied":60,"reserved":0,"environment":{"temperature_c":-18.4,"humidity_pct":55},"occupancy":{"current_occupants":2,"count_verified":true,"presence":true}},
    {"id":"D","name":"Khu đệm","range":[18,28],"capacity":48,"occupied":32,"reserved":0,"environment":{"temperature_c":22.1,"humidity_pct":60},"occupancy":{"current_occupants":1,"count_verified":true,"presence":true}}
  ],
  "doors": [
    {"id":"D01","zone":"A","state":"closed","beam_clear":true,"panic_latched":false,"local_inputs_healthy":true,"open_seconds":0,"updated_at":"2026-10-12T02:00:00.000Z"},
    {"id":"D02","zone":"A","state":"open","beam_clear":true,"panic_latched":false,"local_inputs_healthy":true,"open_seconds":12,"updated_at":"2026-10-12T02:00:00.000Z"},
    {"id":"D03","zone":"A","state":"closed","beam_clear":true,"panic_latched":false,"local_inputs_healthy":true,"open_seconds":0,"updated_at":"2026-10-12T02:00:00.000Z"},
    {"id":"D04","zone":"B","state":"closed","beam_clear":true,"panic_latched":false,"local_inputs_healthy":true,"open_seconds":0,"updated_at":"2026-10-12T02:00:00.000Z"},
    {"id":"D05","zone":"B","state":"closed","beam_clear":true,"panic_latched":false,"local_inputs_healthy":true,"open_seconds":0,"updated_at":"2026-10-12T02:00:00.000Z"},
    {"id":"D06","zone":"B","state":"closed","beam_clear":true,"panic_latched":false,"local_inputs_healthy":true,"open_seconds":0,"updated_at":"2026-10-12T02:00:00.000Z"},
    {"id":"D07","zone":"C","state":"open","beam_clear":true,"panic_latched":false,"local_inputs_healthy":true,"open_seconds":42,"updated_at":"2026-10-12T02:00:00.000Z"},
    {"id":"D08","zone":"C","state":"closed","beam_clear":true,"panic_latched":false,"local_inputs_healthy":true,"open_seconds":0,"updated_at":"2026-10-12T02:00:00.000Z"},
    {"id":"D09","zone":"C","state":"closed","beam_clear":true,"panic_latched":false,"local_inputs_healthy":true,"open_seconds":0,"updated_at":"2026-10-12T02:00:00.000Z"},
    {"id":"D10","zone":"D","state":"closed","beam_clear":true,"panic_latched":false,"local_inputs_healthy":true,"open_seconds":0,"updated_at":"2026-10-12T02:00:00.000Z"},
    {"id":"D11","zone":"D","state":"closed","beam_clear":true,"panic_latched":false,"local_inputs_healthy":true,"open_seconds":0,"updated_at":"2026-10-12T02:00:00.000Z"},
    {"id":"D12","zone":"D","state":"closed","beam_clear":true,"panic_latched":false,"local_inputs_healthy":true,"open_seconds":0,"updated_at":"2026-10-12T02:00:00.000Z"}
  ],
  "devices": [
    {"id":"SIM-A01","zone":"A","source":"node-simulator","state":"online","freshness":"fresh","last_seen_at":"2026-10-12T02:00:00.000Z","boot_id":"boot-example-001","session_id":"session-example-001","controller_revision":42},
    {"id":"SIM-B01","zone":"B","source":"node-simulator","state":"online","freshness":"fresh","last_seen_at":"2026-10-12T02:00:00.000Z","boot_id":"boot-example-001","session_id":"session-example-001","controller_revision":42},
    {"id":"ESP-C01","zone":"C","source":"wokwi","state":"online","freshness":"fresh","last_seen_at":"2026-10-12T02:00:00.000Z","boot_id":"boot-example-001","session_id":"session-example-001","controller_revision":42},
    {"id":"SIM-C02","zone":"C","source":"node-simulator","state":"online","freshness":"fresh","last_seen_at":"2026-10-12T02:00:00.000Z","boot_id":"boot-example-001","session_id":"session-example-001","controller_revision":42},
    {"id":"SIM-D01","zone":"D","source":"node-simulator","state":"online","freshness":"fresh","last_seen_at":"2026-10-12T02:00:00.000Z","boot_id":"boot-example-001","session_id":"session-example-001","controller_revision":42}
  ],
  "alerts": [
    {"id":"door","zone":"C","code":"DOOR_OPEN_WARNING","title":"Cửa D07 mở quá thời gian","detail":"Đã mở 42 giây · Ngưỡng cảnh báo 30 giây","level":"warning","state":"active","acknowledged":false,"raised_at":"2026-10-12T02:00:00.000Z"},
    {"id":"temperature","zone":"B","code":"TEMPERATURE_OUT_OF_RANGE","title":"Nhiệt độ kho mát vượt ngưỡng","detail":"9,2°C · Khoảng cho phép 2–8°C","level":"warning","state":"active","acknowledged":false,"raised_at":"2026-10-12T02:00:00.000Z"}
  ]
}
